<?xml version="1.0" encoding="UTF-8"?>
<!--
To change this template, choose Tools | Templates
and open the template in the editor.
-->
<?xml-stylesheet type="text/xsl" href="roster.xsl"?>

<rostertype xmlns:xsi='http://www.w3.org/2001/XMLSchema-instance'
            xsi:noNamespaceSchemaLocation='roster.xsd'>
    <inducements></inducements>
    <name>NorseKey</name>
    <reroll>60000</reroll>
    <apothecary>true</apothecary>
    <chef>300000</chef>
    <igor>false</igor>
    <bribe>100000</bribe>
    <max_big_guy>1</max_big_guy>
    <playertypes>               
        <playerType>
            <limit>4</limit>
            <position>Blitzer</position>
            <movement>6</movement>
            <strength>3</strength>
            <agility>3</agility>
            <armor>7</armor>
            <skills>
                <skill>Block</skill>
                <skill>Jump Up</skill>
                <skill>Frenzy</skill>
            </skills>
            <cost>90000</cost>
            <single>
                <skillType>General Skill</skillType>
                <skillType>Strength Skill</skillType>
            </single>
            <double>
                <skillType>General Trait</skillType>
                <skillType>Strength Trait</skillType>
                <skillType>Agility Skill</skillType>
                <skillType>Pass Skill</skillType>
            </double>
        </playerType>
        <playerType>
            <limit>2</limit>
            <position>Catcher</position>
            <movement>6</movement>
            <strength>3</strength>
            <agility>3</agility>
            <armor>7</armor>
            <skills>
                <skill>Block</skill>
                <skill>Catch</skill>
            </skills>
            <cost>70000</cost>
            <single>
                <skillType>General Skill</skillType>
                <skillType>Agility Skill</skillType>
            </single>
            <double>
                <skillType>General Trait</skillType>
                <skillType>Agility Trait</skillType>
                <skillType>Strength Skill</skillType>
                <skillType>Pass Skill</skillType>                
            </double>
        </playerType>
        <playerType>
            <limit>2</limit>
            <position>Thrower</position>
            <movement>6</movement>
            <strength>3</strength>
            <agility>3</agility>
            <armor>7</armor>
            <skills>
                <skill>Block</skill>
                <skill>Pass</skill>
            </skills>
            <cost>70000</cost>
            <single>
                <skillType>General Skill</skillType>
                <skillType>Pass Skill</skillType>
            </single>
            <double>
                <skillType>General Trait</skillType>
                <skillType>Pass Trait</skillType>
                <skillType>Strength Skill</skillType>
                <skillType>Agility Skill</skillType>                
            </double>
        </playerType>
        <playerType>
            <limit>12</limit>
            <position>Lineman</position>
            <movement>6</movement>
            <strength>3</strength>
            <agility>3</agility>
            <armor>7</armor>
            <skills>
                <skill>Block</skill>
            </skills>
            <cost>50000</cost>
            <single>
                <skillType>General Skill</skillType>                
            </single>
            <double>
                <skillType>General Trait</skillType>                
                <skillType>Strength Skill</skillType>
                <skillType>Pass Skill</skillType>   
                <skillType>Agility Skill</skillType>             
            </double>
        </playerType>
        <playerType>
            <limit>1</limit>
            <position>Minotaur</position>
            <movement>5</movement>
            <strength>5</strength>
            <agility>2</agility>
            <armor>8</armor>
            <skills>
                <skill>Big Guy</skill>
                <skill>Wild Animal</skill>
                <skill>Mighty Blow</skill>
                <skill>Thick Skull</skill>
                <skill>Frenzy</skill>
                <skill>Horns</skill>
                <skill>Always Hungry</skill>
                <skill>Throw Team-Mate</skill>              
            </skills>
            <cost>110000</cost>
            <single>
                <skillType>Strength Skill</skillType>
            </single>
            <double>
                <skillType>Strength Trait</skillType>
                <skillType>Physical Trait</skillType>
                <skillType>General Skill</skillType>
                <skillType>Agility Skill</skillType>
                <skillType>Pass Skill</skillType>
            </double>
        </playerType>
        <playerType>
            <limit>1</limit>
            <position>Ogre</position>
            <movement>5</movement>
            <strength>5</strength>
            <agility>2</agility>
            <armor>9</armor>
            <skills>
                <skill>Bone Head</skill>
                <skill>Mighty Blow</skill>
                <skill>Thick Skull</skill>
                <skill>Throw Team-Mate</skill>
                <skill>Big Guy</skill>
            </skills>
            <cost>120000</cost>
            <single>
                <skillType>Strength Skill</skillType>
            </single>
            <double>
                <skillType>Strength Trait</skillType>
                <skillType>General Skill</skillType>                
                <skillType>Pass Skill</skillType>
                <skillType>Agility Skill</skillType>
            </double>
        </playerType>
    </playertypes>
</rostertype>


