<?xml version="1.0" encoding="UTF-8"?>
<!--
To change this template, choose Tools | Templates
and open the template in the editor.
-->
<?xml-stylesheet type="text/xsl" href="roster.xsl"?>

<rostertype xmlns:xsi='http://www.w3.org/2001/XMLSchema-instance'
            xsi:noNamespaceSchemaLocation='roster.xsd'>
 <inducements>
        <inducement name="wizard" max="1" cost="50000"/>
    </inducements>
    <name>LizardmenKey</name>
    <reroll>60000</reroll>
    <apothecary>true</apothecary>
    <max_big_guy>1</max_big_guy>
    <playertypes>               
        <playerType>
            <limit>6</limit>
            <position>Saurus</position>
            <movement>6</movement>
            <strength>4</strength>
            <agility>1</agility>
            <armor>9</armor>
            <skills>
            </skills>
            <cost>80000</cost>
            <single>
                <skillType>General Skill</skillType>
                <skillType>Strength Skill</skillType>
            </single>
            <double>
                <skillType>General Trait</skillType>
                <skillType>Strength Trait</skillType>
                <skillType>Agility Skill</skillType>
                <skillType>Pass Skill</skillType>
            </double>
        </playerType>
        <playerType>
            <limit>16</limit>
            <position>Skink</position>
            <movement>8</movement>
            <strength>2</strength>
            <agility>3</agility>
            <armor>7</armor>
            <skills>
                <skill>Dodge</skill>
                <skill>Stunty</skill>
            </skills>
            <cost>60000</cost>
            <single>                
                <skillType>Agility Skill</skillType>
            </single>
            <double>
                <skillType>Agility Trait</skillType>
                <skillType>General Skill</skillType>
                <skillType>Pass Skill</skillType>
                <skillType>Strength Skill</skillType>
            </double>
        </playerType>
        <playerType>
            <limit>1</limit>
            <position>Kroxigor</position>
            <movement>6</movement>
            <strength>5</strength>
            <agility>1</agility>
            <armor>9</armor>
            <skills>
                <skill>Bone Head</skill>
                <skill>Thick Skull</skill>
                <skill>Prehensile Tail</skill>
                <skill>Big Guy</skill>
            </skills>
            <cost>130000</cost>
            <single>
                <skillType>Strength Skill</skillType>                
            </single>
            <double>
                <skillType>Strength Trait</skillType>                
                <skillType>General Skill</skillType>
                <skillType>Agility Skill</skillType>
                <skillType>Pass Skill</skillType>
            </double>
        </playerType>     
    </playertypes>
</rostertype>


