<?xml version="1.0" encoding="UTF-8"?>
<!--
To change this template, choose Tools | Templates
and open the template in the editor.
-->
<?xml-stylesheet type="text/xsl" href="roster.xsl"?>

<rostertype xmlns:xsi='http://www.w3.org/2001/XMLSchema-instance'
            xsi:noNamespaceSchemaLocation='roster.xsd'>
    <inducements>
        <inducement name="chef" max="1" cost="300000" />
        <inducement name="bribe the ref" max="3" cost="100000" />
        <inducement name="Bloodweisers' babes" max="2" cost="50000" />
        <inducement name="wizard" max="1" cost="150000" />
        <inducement name="extra reroll" max="4" cost="100000" />
        <inducement name="local apothecary" max="1" cost="100000" />
        <inducement name="cards" max="8" cost="50000" />
     </inducements>
    <name>OrcKey</name>
    <reroll>60000</reroll>
    <apothecary>true</apothecary>
    <chef>300000</chef>
    <igor>false</igor>
    <bribe>100000</bribe>
    <playertypes>               
        <playerType>
            <limit>4</limit>
            <position>Blitzer</position>
            <movement>6</movement>
            <strength>3</strength>
            <agility>3</agility>
            <armor>9</armor>
            <skills>
                <skill>Block</skill>
            </skills>
            <cost>80000</cost>
            <single>
                <skillType>General</skillType>
                <skillType>Strength</skillType>
            </single>
            <double>
                <skillType>Agility</skillType>
                <skillType>Pass</skillType>
            </double>
        </playerType>
        <playerType>
            <limit>4</limit>
            <position>Black Orc Blocker</position>
            <movement>4</movement>
            <strength>4</strength>
            <agility>2</agility>
            <armor>9</armor>
            <skills>
            </skills>
            <cost>80000</cost>
            <single>
                <skillType>General</skillType>
                <skillType>Strength</skillType>                
            </single>
            <double>
                <skillType>Pass</skillType>
                <skillType>Agility</skillType>
            </double>
        </playerType>
        <playerType>
            <limit>4</limit>
            <position>Goblin</position>
            <movement>6</movement>
            <strength>2</strength>
            <agility>3</agility>
            <armor>7</armor>
            <skills>
                <skill>Dodge</skill>
                <skill>Stunty</skill>
                <skill>Right Stuff</skill>
            </skills>
            <cost>40000</cost>
            <single>               
                <skillType>Agility</skillType>
            </single>
            <double>
                <skillType>General</skillType>
                <skillType>Strength</skillType>
                <skillType>Pass</skillType>
            </double>
        </playerType>
        <playerType>
            <limit>16</limit>
            <position>Lineman</position>
            <movement>5</movement>
            <strength>3</strength>
            <agility>3</agility>
            <armor>9</armor>
            <skills>
            </skills>
            <cost>50000</cost>
            <single>
                <skillType>General</skillType>
            </single>
            <double>
                <skillType>Strength</skillType>
                <skillType>Pass</skillType>
                <skillType>Agility</skillType>
            </double>
        </playerType>
         <playerType>
            <limit>2</limit>
            <position>Thrower</position>
            <movement>5</movement>
            <strength>3</strength>
            <agility>3</agility>
            <armor>8</armor>
            <skills>
                <skill>Sure Hands</skill>
                <skill>Pass</skill>
            </skills>
            <cost>70000</cost>
            <single>
                <skillType>General</skillType>
                <skillType>Pass</skillType>
            </single>
            <double>
                <skillType>Strength</skillType>                
                <skillType>Agility</skillType>
            </double>
        </playerType>
        <playerType>
            <limit>1</limit>
            <position>Troll</position>
            <movement>4</movement>
            <strength>5</strength>
            <agility>1</agility>
            <armor>9</armor>
            <skills>
                <skill>Loner</skill>
                <skill>Really Stupid</skill>
                <skill>Always Hungry</skill>
                <skill>Mighty Blow</skill>
                <skill>Regeneration</skill>
                <skill>Throw Team-Mate</skill>
            </skills>
            <cost>110000</cost>
            <single>
                <skillType>Strength</skillType>
            </single>
            <double>
                <skillType>General</skillType>
                <skillType>Pass</skillType>
                <skillType>Agility</skillType>
            </double>
        </playerType>
    </playertypes>
</rostertype>


