<?xml version="1.0" encoding="UTF-8"?>
<!--
To change this template, choose Tools | Templates
and open the template in the editor.
-->
<?xml-stylesheet type="text/xsl" href="roster.xsl"?>

<rostertype xmlns:xsi='http://www.w3.org/2001/XMLSchema-instance'
            xsi:noNamespaceSchemaLocation='roster.xsd'>
    <inducements></inducements>
    <name>OgreKey</name>
    <reroll>70000</reroll>
    <apothecary>true</apothecary>
    <chef>300000</chef>
    <igor>false</igor>
    <bribe>100000</bribe>
    
    <playertypes>               
         <playerType>
            <limit>12</limit>
            <position>Ogre</position>
            <movement>5</movement>
            <strength>5</strength>
            <agility>2</agility>
            <armor>9</armor>
            <skills>
                <skill>Bone Head</skill>
                <skill>Mighty Blow</skill>
                <skill>Thick Skull</skill>
                <skill>Throw Team-Mate</skill>
            </skills>
            <cost>120000</cost>
            <single>
                <skillType>Strength Skill</skillType>
            </single>
            <double>
                <skillType>Strength Trait</skillType>
                <skillType>General Skill</skillType>                
                <skillType>Pass Skill</skillType>
                <skillType>Agility Skill</skillType>
            </double>
        </playerType>
        
        <playerType>
            <limit>6</limit>
            <position>Goblin</position>
            <movement>6</movement>
            <strength>2</strength>
            <agility>3</agility>
            <armor>7</armor>
            <skills>
                <skill>Dodge</skill>
                <skill>Right Stuff</skill>
                <skill>Stunty</skill>
            </skills>
            <cost>40000</cost>
            <single>
                <skillType>Agility Skill</skillType>                
            </single>
            <double>
                <skillType>Agility Trait</skillType>                
                <skillType>Strength Skill</skillType>
                <skillType>Pass Skill</skillType>
                <skillType>General Skill</skillType>
            </double>
        </playerType>
    </playertypes>
</rostertype>


