<?xml version="1.0" encoding="UTF-8"?>
<!--
To change this template, choose Tools | Templates
and open the template in the editor.
-->
<?xml-stylesheet type="text/xsl" href="roster.xsl"?>

<rostertype xmlns:xsi='http://www.w3.org/2001/XMLSchema-instance'
            xsi:noNamespaceSchemaLocation='roster.xsd'>
    <inducements></inducements>
    <name>HalflingKey</name>
    <reroll>60000</reroll>
    <apothecary>true</apothecary>
    <chef>100000</chef>
    <igor>false</igor>
    <bribe>100000</bribe>
    <max_big_guy>2</max_big_guy>
    <playertypes>               
        <playerType>
            <limit>2</limit>
            <position>Treeman</position>
            <movement>2</movement>
            <strength>6</strength>
            <agility>1</agility>
            <armor>10</armor>
            <skills>
                <skill>Take Roots</skill>
                <skill>Stand Firm</skill>
                <skill>Mighty Blow</skill>
                <skill>Thick Skull</skill>
                <skill>Big Guy</skill>
                <skill>Throw Team-Mate</skill>
            </skills>
            <cost>110000</cost>
            <single>
                <skillType>Strength Skill</skillType>
            </single>
            <double>
                <skillType>Strength Trait</skillType>
                <skillType>General Skill</skillType>
                <skillType>Pass Skill</skillType>
                <skillType>Agility Skill</skillType>
            </double>
        </playerType>
        <playerType>
            <limit>16</limit>
            <position>Halflings</position>
            <movement>5</movement>
            <strength>2</strength>
            <agility>3</agility>
            <armor>6</armor>
            <skills>
                <skill>Dodge</skill>
                <skill>Stunty</skill>
                <skill>Right Stuff</skill>
            </skills>
            <cost>30000</cost>
            <single>               
                <skillType>Agility Skill</skillType>
            </single>
            <double>
                <skillType>Agility Trait</skillType>
                <skillType>General Skill</skillType>
                <skillType>Strength Skill</skillType>
                <skillType>Pass Skill</skillType>
            </double>
        </playerType>
        <playerType>
            <limit>1</limit>
            <position>Ogre</position>
            <movement>5</movement>
            <strength>5</strength>
            <agility>2</agility>
            <armor>9</armor>
            <skills>
                <skill>Bone Head</skill>
                <skill>Mighty Blow</skill>
                <skill>Thick Skull</skill>
                <skill>Throw Team-Mate</skill>
                <skill>Big Guy</skill>
            </skills>
            <cost>120000</cost>
            <single>
                <skillType>Strength Skill</skillType>
            </single>
            <double>
                <skillType>General Skill</skillType>
                <skillType>Strength Trait</skillType>
                <skillType>Pass Skill</skillType>
                <skillType>Agility Skill</skillType>
            </double>
        </playerType>
    </playertypes>
</rostertype>


