<?xml version="1.0" encoding="UTF-8"?>
<!--
To change this template, choose Tools | Templates
and open the template in the editor.
-->
<?xml-stylesheet type="text/xsl" href="roster.xsl"?>

<rostertype xmlns:xsi='http://www.w3.org/2001/XMLSchema-instance'
            xsi:noNamespaceSchemaLocation='roster.xsd'>

    <name>NecromanticHorrorKey</name>
    <reroll>70000</reroll>
    <apothecary>false</apothecary>
    <chef>300000</chef>
    <igor>true</igor>
    <bribe>100000</bribe>
    <playertypes>               
        <playerType>
            <limit>2</limit>
            <position>Werewolf</position>
            <movement>8</movement>
            <strength>3</strength>
            <agility>3</agility>
            <armor>8</armor>
            <skills>
                <skill>Frenzy</skill>
                <skill>Regeneration</skill>
                <skill>Claws</skill>
            </skills>
            <cost>120000</cost>
            <single>
                <skillType>General</skillType>
                <skillType>Agility</skillType>
            </single>
            <double>
                <skillType>Strength</skillType>
                <skillType>Pass</skillType>
            </double>
        </playerType>
        <playerType>
            <limit>2</limit>
            <position>Ghoul</position>
            <movement>7</movement>
            <strength>3</strength>
            <agility>3</agility>
            <armor>7</armor>
            <skills>
                <skill>Dodge</skill>
            </skills>
            <cost>70000</cost>
            <single>
                <skillType>General</skillType>
                <skillType>Agility</skillType>
            </single>
            <double>
                <skillType>Strength</skillType>
                <skillType>Pass</skillType>
            </double>
        </playerType>
        <playerType>
             <limit>2</limit>
            <position>Wight</position>
            <movement>6</movement>
            <strength>3</strength>
            <agility>3</agility>
            <armor>8</armor>
            <skills>
                <skill>Block</skill>
                <skill>Regeneration</skill>
            </skills>
            <cost>90000</cost>
            <single>
                <skillType>General</skillType>
                <skillType>Strength</skillType>
            </single>
            <double>
                <skillType>Pass</skillType>
                <skillType>Agility</skillType>
            </double>
        </playerType>
        <playerType>
            <limit>2</limit>
            <position>Flesh Golem</position>
            <movement>4</movement>
            <strength>4</strength>
            <agility>2</agility>
            <armor>9</armor>
            <skills>
                <skill>Stand Firm</skill>
                <skill>Regeneration</skill>
                <skill>Thick Skull</skill>
            </skills>
            <cost>110000</cost>
            <single>
                <skillType>General</skillType>
                <skillType>Strength</skillType>
            </single>
            <double>
                <skillType>Pass</skillType>
                <skillType>Agility</skillType>
            </double>
        </playerType>
        <playerType>
            <limit>16</limit>
            <position>Zombie</position>
            <movement>4</movement>
            <strength>3</strength>
            <agility>2</agility>
            <armor>8</armor>
            <skills>
                <skill>Regeneration</skill>
            </skills>
            <cost>40000</cost>
            <single>
                <skillType>General</skillType>
            </single>
            <double>
                <skillType>Strength</skillType>
                <skillType>Pass</skillType>
                <skillType>Agility</skillType>
            </double>
        </playerType>
    </playertypes>
</rostertype>


