<?xml version="1.0" encoding="UTF-8"?>
<!--
To change this template, choose Tools | Templates
and open the template in the editor.
-->
<?xml-stylesheet type="text/xsl" href="roster.xsl"?>

<rostertype xmlns:xsi='http://www.w3.org/2001/XMLSchema-instance'
            xsi:noNamespaceSchemaLocation='roster.xsd'>

    <name>WoodElfKey</name>
    <reroll>50000</reroll>
    <apothecary>true</apothecary>
    <max_big_guy>1</max_big_guy>
    <inducements>
        <inducement name="chef" max="1" cost="300000" />
        <inducement name="bribe the ref" max="3" cost="100000" />
        <inducement name="Bloodweisers' babes" max="2" cost="50000" />
        <inducement name="wizard" max="1" cost="150000" />
        <inducement name="extra reroll" max="4" cost="100000" />
        <inducement name="local apothecary" max="1" cost="100000" />
        <inducement name="cards" max="8" cost="50000" />
        <inducement name="specialist assistant coaches" max="5" cost="20000" />
        <inducement name="temp agency cheerleaders" max="5" cost="20000" />
        <inducement name="weather mage" max="1" cost="30000" />
        <inducement name="Horatio X Schottenheim" max="1" cost="80000" />
        <inducement name="Galandril Silverwater" max="1" cost="50000" />
    </inducements>
    <playertypes>               
        <playerType>
            <limit>2</limit>
            <position>Wardancer</position>
            <movement>8</movement>
            <strength>3</strength>
            <agility>2</agility>
            <pass>4</pass>
            <armor>8</armor>
            <skills>
                <skill>Dodge</skill>
                <skill>Block</skill>
                <skill>Leap</skill>
            </skills>
            <cost>125000</cost>
            <single>
                <skillType>General</skillType>
                <skillType>Agility</skillType>
            </single>
            <double>
                <skillType>Pass</skillType>            
                <skillType>Strength</skillType>
            </double>
        </playerType>
        
        <playerType>
            <limit>2</limit>
            <position>Thrower</position>
            <movement>7</movement>
            <strength>3</strength>
            <agility>2</agility>
            <pass>2</pass>
            <armor>8</armor>
            <skills>
                <skill>Pass</skill>
            </skills>
            <cost>95000</cost>
            <single>
                <skillType>General</skillType>
                <skillType>Pass</skillType>
                <skillType>Agility</skillType>
            </single>
            <double>
                <skillType>Strength</skillType>
            </double>
        </playerType>
        <playerType>
            <limit>4</limit>
            <position>Catcher</position>
            <movement>8</movement>
            <strength>2</strength>
            <agility>2</agility>
            <pass>4</pass>
            <armor>8</armor>
            <skills>
                <skill>Dodge</skill>
                <skill>Catch</skill>
            </skills>
            <cost>90000</cost>
            <single>
                <skillType>General</skillType>
                <skillType>Agility</skillType>
            </single>
            <double>
                <skillType>Strength</skillType>
                <skillType>Pass</skillType>
            </double>
        </playerType>
        <playerType>
            <limit>12</limit>
            <position>Wood Elf Lineman</position>
            <movement>7</movement>
            <strength>3</strength>
           <agility>2</agility>
            <pass>4</pass>
            <armor>8</armor>
            <skills>
            </skills>
            <cost>70000</cost>
            <single>
                <skillType>General</skillType>
                <skillType>Agility</skillType>
            </single>
            <double>
                <skillType>Strength</skillType>
            </double>
        </playerType>
        <playerType>
            <limit>1</limit>
            <position>Loren Forest Treeman</position>
            <movement>2</movement>
            <strength>6</strength>
            <agility>5</agility>
            <pass>5</pass>
            <armor>11</armor>
            <skills>
                  <skill>Take Roots</skill>
                  <skill>Loner (4+)</skill>
                  <skill>Stand Firm</skill>
                  <skill>Mighty Blow (+1)</skill>
                  <skill>Thick Skull</skill>
                  <skill>Strong Arm</skill>
                  <skill>Throw Team-Mate</skill>
                  <skill>Big Guy</skill>
            </skills>
            <cost>120000</cost>
            <single>
                <skillType>Strength</skillType>
            </single>
            <double>
                <skillType>General</skillType>
                <skillType>Agility</skillType>
            </double>
        </playerType>
    </playertypes>
</rostertype>


