<?xml version="1.0" encoding="UTF-8"?>
<!--
To change this template, choose Tools | Templates
and open the template in the editor.
-->
<?xml-stylesheet type="text/xsl" href="roster.xsl"?>

<rostertype xmlns:xsi='http://www.w3.org/2001/XMLSchema-instance'
            xsi:noNamespaceSchemaLocation='roster.xsd'>

    <name>DarkElfKey</name>
    <reroll>50000</reroll>
    <apothecary>true</apothecary>
    
    <inducements>
        <inducement name="chef" max="1" cost="300000" />
        <inducement name="bribe the ref" max="3" cost="100000" />
        <inducement name="Bloodweisers' babes" max="2" cost="50000" />
        <inducement name="wizard" max="1" cost="150000" />
        <inducement name="extra reroll" max="4" cost="100000" />
        <inducement name="local apothecary" max="1" cost="100000" />
        <inducement name="cards" max="8" cost="50000" />
        <inducement name="specialist assistant coaches" max="5" cost="20000" />
        <inducement name="temp agency cheerleaders" max="5" cost="20000" />
        <inducement name="weather mage" max="1" cost="30000" />
        <inducement name="Druchii sports sorceress" max="1" cost="150000" />
        <inducement name="Horatio X Schottenheim" max="1" cost="80000" />
    </inducements>   
    
    <playertypes>               
        <playerType>
            <limit>4</limit>
            <position>Blitzer</position>
            <movement>7</movement>
            <strength>3</strength>
            <agility>4</agility>
            <armor>8</armor>
            <skills>
                <skill>Block</skill>
            </skills>
            <cost>100000</cost>
            <single>
                <skillType>General</skillType>
                <skillType>Agility</skillType>
            </single>
            <double>
                <skillType>Pass</skillType>
                <skillType>Strength</skillType>
            </double>
        </playerType>
        <playerType>
            <limit>2</limit>
            <position>Witch Elf</position>
            <movement>7</movement>
            <strength>3</strength>
            <agility>4</agility>
            <armor>7</armor>
            <skills>
                <skill>Dodge</skill>
                <skill>Frenzy</skill>
                <skill>Jump Up</skill>
            </skills>
            <cost>110000</cost>
            <single>
                <skillType>General</skillType>
                <skillType>Agility</skillType>
            </single>
            <double>
                <skillType>Strength</skillType>
                <skillType>Pass</skillType>
            </double>
        </playerType>
        <playerType>
            <limit>2</limit>
            <position>Runner</position>
            <movement>7</movement>
            <strength>3</strength>
            <agility>4</agility>
            <armor>7</armor>
            <skills>
                <skill>Dump-Off</skill>
            </skills>
            <cost>80000</cost>
            <single>
                <skillType>General</skillType>
                <skillType>Agility</skillType>
                <skillType>Pass</skillType>
            </single>
            <double>
                <skillType>Strength</skillType>
            </double>
        </playerType>
         <playerType>
            <limit>2</limit>
            <position>Assassin</position>
            <movement>6</movement>
            <strength>3</strength>
            <agility>4</agility>
            <armor>7</armor>
            <skills>
                <skill>Stab</skill>
                <skill>Shadowing</skill>
            </skills>
            <cost>90000</cost>
            <single>
                <skillType>General</skillType>
                <skillType>Agility</skillType>
            </single>
            <double>
                <skillType>Strength</skillType>
                <skillType>Pass</skillType>   
            </double>
        </playerType>
        <playerType>
            <limit>16</limit>
            <position>Lineman</position>
            <movement>6</movement>
            <strength>3</strength>
            <agility>4</agility>
            <armor>8</armor>
            <skills>
            </skills>
            <cost>70000</cost>
            <single>
                <skillType>General</skillType>
                <skillType>Agility</skillType>
            </single>
            <double>
                <skillType>Strength</skillType>
                <skillType>Pass</skillType>            
            </double>
        </playerType>
    </playertypes>
</rostertype>


